{
  "schema": "codebox.result/v1",
  "request_id": "0839967e-d554-4207-8798-f9cec0376296",
  "tool": "codebox_run",
  "box": "poly",
  "status": "ok",
  "received_at": "2026-09-24T10:49:51.995Z",
  "finished_at": "2026-09-24T10:49:55.291Z",
  "duration_ms": 3296,
  "channel": {
    "received_via": "stdio",
    "response_channel": "stdio",
    "response_path": null,
    "delivered": null,
    "delivery_error": null
  },
  "files": {
    "written": [],
    "rejected": []
  },
  "index": null,
  "setup": null,
  "execution": {
    "run_id": "20260924104951-69a202c4",
    "entry": "py/main.py",
    "language": "python",
    "command": [
      "docker",
      "exec",
      "-i",
      "-w",
      "/workspace/codes/py",
      "-e",
      "CODEBOX_RUN_ID=20260924104951-69a202c4",
      "-e",
      "CODEBOX_TELEMETRY_OUT=/workspace/runs/20260924104951-69a202c4/telemetry.json",
      "-e",
      "CODEBOX_TIMEOUT_MS=60000",
      "codebox-poly",
      "codebox-run",
      "/workspace/codes/py/main.py"
    ],
    "exit_code": 0,
    "signal": null,
    "timed_out": false,
    "wall_ms": 1788,
    "stdout": "sum 8999995500000500000\n",
    "stderr": "",
    "stdout_bytes": 24,
    "stderr_bytes": 0,
    "stdout_truncated": false,
    "stderr_truncated": false
  },
  "telemetry": {
    "schema": "codebox.telemetry/v1",
    "runner": {
      "language": "python",
      "name": "codebox-run-py",
      "sdk": "opentelemetry-python",
      "sdk_version": "1.44.0"
    },
    "run_id": "20260924104951-69a202c4",
    "box": "poly",
    "entry": "/workspace/codes/py/main.py",
    "command": [
      "/opt/codebox/venv/bin/python3",
      "/workspace/codes/py/main.py"
    ],
    "compile": null,
    "process": {
      "pid": 981,
      "exit_code": 0,
      "signal": null,
      "timed_out": false,
      "spawn_error": null,
      "started_at": "2026-09-24T10:49:52.236234+00:00",
      "ended_at": "2026-09-24T10:49:53.756432+00:00",
      "duration_ms": 1520.187475
    },
    "resources": {
      "user_cpu_ms": 217.516,
      "system_cpu_ms": 60.038999999999994,
      "max_rss_kb": 126564,
      "minor_page_faults": 30296,
      "major_page_faults": 0,
      "voluntary_ctx_switches": 2,
      "involuntary_ctx_switches": 2,
      "fs_in_blocks": 0,
      "fs_out_blocks": 0,
      "threads": null
    },
    "otel": {
      "resource": {
        "telemetry.sdk.language": "python",
        "telemetry.sdk.name": "opentelemetry",
        "telemetry.sdk.version": "1.44.0",
        "service.instance.id": "304865c7-f74d-49fc-ba1c-f1912fed0b84",
        "service.name": "codebox-poly",
        "service.version": "1.0.0",
        "codebox.box": "poly",
        "codebox.run_id": "20260924104951-69a202c4",
        "process.runtime.name": "cpython",
        "process.runtime.version": "3.12.14",
        "host.name": "vm"
      },
      "spans": [
        {
          "name": "process.exec",
          "trace_id": "cc0cdb7f6a262d03fa4333c2efd72e3e",
          "span_id": "d693be61b2461288",
          "parent_span_id": "1436bc1f287d7439",
          "kind": "CLIENT",
          "start_time_unix_nano": "1790246992236453674",
          "end_time_unix_nano": "1790246993756332337",
          "duration_ms": 1519.878663,
          "status": {
            "code": "OK",
            "message": null
          },
          "attributes": {
            "process.command": "/opt/codebox/venv/bin/python3",
            "process.command_args": [
              "/opt/codebox/venv/bin/python3",
              "/workspace/codes/py/main.py"
            ],
            "process.pid": 981,
            "process.exit.code": 0
          },
          "events": []
        },
        {
          "name": "codebox.run",
          "trace_id": "cc0cdb7f6a262d03fa4333c2efd72e3e",
          "span_id": "1436bc1f287d7439",
          "parent_span_id": null,
          "kind": "INTERNAL",
          "start_time_unix_nano": "1790246992236355930",
          "end_time_unix_nano": "1790246993756407746",
          "duration_ms": 1520.051816,
          "status": {
            "code": "OK",
            "message": null
          },
          "attributes": {
            "code.filepath": "/workspace/codes/py/main.py",
            "codebox.language": "python",
            "process.exit.code": 0
          },
          "events": []
        }
      ],
      "metrics": [
        {
          "name": "process.duration",
          "unit": "ms",
          "type": "HISTOGRAM",
          "data_points": [
            {
              "attributes": {
                "code.filepath": "/workspace/codes/py/main.py"
              },
              "value": {
                "count": 1,
                "sum": 1520.187475,
                "min": 1520.187475,
                "max": 1520.187475,
                "buckets": {
                  "boundaries": [
                    0,
                    5,
                    10,
                    25,
                    50,
                    75,
                    100,
                    250,
                    500,
                    750,
                    1000,
                    2500,
                    5000,
                    7500,
                    10000
                  ],
                  "counts": [
                    0,
                    0,
                    0,
                    0,
                    0,
                    0,
                    0,
                    0,
                    0,
                    0,
                    0,
                    1,
                    0,
                    0,
                    0,
                    0
                  ]
                }
              }
            }
          ]
        },
        {
          "name": "process.cpu.time",
          "unit": "ms",
          "type": "SUM",
          "data_points": [
            {
              "attributes": {
                "code.filepath": "/workspace/codes/py/main.py",
                "cpu.mode": "user"
              },
              "value": 217.516
            },
            {
              "attributes": {
                "code.filepath": "/workspace/codes/py/main.py",
                "cpu.mode": "system"
              },
              "value": 60.038999999999994
            }
          ]
        },
        {
          "name": "process.memory.max_rss",
          "unit": "KiBy",
          "type": "GAUGE",
          "data_points": [
            {
              "attributes": {
                "code.filepath": "/workspace/codes/py/main.py"
              },
              "value": 126564
            }
          ]
        },
        {
          "name": "process.paging.faults",
          "unit": "{fault}",
          "type": "SUM",
          "data_points": [
            {
              "attributes": {
                "code.filepath": "/workspace/codes/py/main.py",
                "process.paging.fault_type": "minor"
              },
              "value": 30296
            },
            {
              "attributes": {
                "code.filepath": "/workspace/codes/py/main.py",
                "process.paging.fault_type": "major"
              },
              "value": 0
            }
          ]
        },
        {
          "name": "process.context_switches",
          "unit": "{count}",
          "type": "SUM",
          "data_points": [
            {
              "attributes": {
                "code.filepath": "/workspace/codes/py/main.py",
                "process.context_switch_type": "voluntary"
              },
              "value": 2
            },
            {
              "attributes": {
                "code.filepath": "/workspace/codes/py/main.py",
                "process.context_switch_type": "involuntary"
              },
              "value": 2
            }
          ]
        }
      ]
    }
  },
  "metrics": {
    "samples": {
      "during": [
        {
          "label": "during-1",
          "captured_at": "2026-09-24T10:49:52.502Z",
          "ps": [
            {
              "pid": 981,
              "ppid": 974,
              "user": "root",
              "cpu_percent": 66.6,
              "mem_percent": 0.7,
              "rss_kb": 126504,
              "vsz_kb": 132400,
              "threads": 1,
              "elapsed_s": 0,
              "state": "S",
              "command": "python3"
            },
            {
              "pid": 974,
              "ppid": 0,
              "user": "root",
              "cpu_percent": 36.1,
              "mem_percent": 0.1,
              "rss_kb": 22152,
              "vsz_kb": 98784,
              "threads": 1,
              "elapsed_s": 0,
              "state": "Ss",
              "command": "python3"
            },
            {
              "pid": 982,
              "ppid": 0,
              "user": "root",
              "cpu_percent": 9.5,
              "mem_percent": 0,
              "rss_kb": 3088,
              "vsz_kb": 3940,
              "threads": 1,
              "elapsed_s": 0,
              "state": "Ss",
              "command": "bash"
            }
          ],
          "top": {
            "load_average": [
              0.87,
              1.03,
              0.62
            ],
            "tasks": {
              "total": 6,
              "running": 1,
              "sleeping": 5,
              "stopped": 0,
              "zombie": 0
            },
            "cpu_percent": {
              "us": 0,
              "sy": 0,
              "ni": 0,
              "id": 100,
              "wa": 0,
              "hi": 0,
              "si": 0,
              "st": 0
            },
            "memory": {
              "unit": "MiB",
              "total": 16095.7,
              "free": 7907.8,
              "used": 978.7,
              "buff/cache": 7533.9
            },
            "swap": {
              "unit": "MiB",
              "total": 0,
              "free": 0,
              "used": 0,
              "avail": 15117
            },